{"approvedCorpusHash":"sha256:49f7dcbfaabdc122294b41f30d56f15d5eca6088d7941f07483968bdd58e1a01","claimBoundary":{"attributionPerformanceClaim":false,"authorizedForResearchEvidence":false,"confirmatory":false,"developmentOnly":true,"publicVisibleFixtures":true},"configuration":{"minimumEvidenceSignals":1,"rankLimit":8,"rulesVersion":"behavioral-heuristic-v1","timeoutMillis":1000},"implementationHash":"sha256:6f0262217b52918ef9030872585b65aaabea2a01756c6a4842343df8f5fef69e","inputContract":{"accessibleArtifactKinds":["label_blind_attribution_corpus"],"forbiddenArtifactKinds":["oracle_package","raw_semantic_execution_package","target_diff","manifest_pairing","fixture_mechanism","expected_outcome"],"schemaId":"https://self-evolving-harness.local/schemas/benchmarks/hfb-label-blind-attribution-corpus.schema.json"},"manifestHash":"sha256:4eb086841a2f8f95835173a645ac0826e8b74586ffdd2635c40aef824cd78933","prototypeId":"development.label-blind-attributor.evidence-v1","schemaVersion":1,"semanticVersion":"0.1.0"}
